小图代码,大图代码,顺序,名称,版本,地点,X,Y,天气,天气图片,时间,动作,动作代码,动作图片,备注,位置图片1,位置图片2
081960,081910,10,乔布要塞,漆黑篇,雷克兰德,37.4,20.9,,,,张望,/lookout,064022.tex,负责水晶都的防卫工作的城塞群之一。原本是雷克兰德联邦时代开设的用于骑士修道会的据点，后来利用其废墟而形成的。如今已经崩坏的光耀教会的遗址，可以让人偶尔联想往日的姿态。,reiku,daibu
081961,081911,11,拉迪斯卡瞭望塔,漆黑篇,雷克兰德,18.4,18.8,,,,张望,/lookout,064022.tex,设置于雷克兰德中央的瞭望塔。所谓的拉迪斯卡，是曾经发现了食罪灵大军飞来，因此让众人避难从而拯救了无数生命的士兵的名字。但据说他自己为了牵制敌人而留在塔中，最终战死。,reiku,daibu
081962,081912,12,拉克汕城,漆黑篇,雷克兰德,22.1,15.1,,,,张望,/lookout,064022.tex,曾经的雷克兰德联盟的王城。因在光之泛滥发生前，率领菁灵族的守旧派挺身而出的身为影之王的人物，奋不顾身地进行最后战斗的场所而闻名。另外拉克汕是代表雷克兰德的古菁灵语。,reiku,daibu
081963,081913,13,奥斯塔尔严命城,漆黑篇,雷克兰德,6.3,15.2,,,,张望,/lookout,064022.tex,化为废墟的雷克兰德联邦的城塞。菁灵族的骑士奥斯塔尔面对迫近的食罪灵大军，为了保护百姓，严令部下一步都不许退，奋战到底。如今的名字就是基于这个故事而起的。,reiku,daibu
081964,081914,14,责罚监狱,漆黑篇,雷克兰德,8.7,22.9,,,,张望,/lookout,064022.tex,雷克兰德联邦时代创建的监狱遗迹。位于悬崖下的废墟，曾经是被关押在狱中的牢犯们居住的场所，据说当时被称作铁锁街。不过，如今已变成废墟，连铁锁似乎都生锈了。,reiku,daibu
081965,081915,15,阴沉乡,漆黑篇,雷克兰德,21.5,36.2,,,,张望,/lookout,064022.tex,始源湖湖畔的渔村。通过用桥把杂草岛、砖土岛、疙瘩岛、波浪岛这四个岛连接而构成。因成天板着脸的渔夫众多，因此自虐式地得到了一个“心情不好”的奇怪的村名。,reiku,daibu
081966,081916,16,碎贝海岸,漆黑篇,珂露西亚岛,33.2,28.9,,,,张望,/lookout,064022.tex,附近渔村滞潮村的居民，以裂开的贝壳数量多这一再合适不过的理由而为之起名的沙滩。过去还汇集着众多渔夫，不过如今治安混乱，唯有野蛮的大哥布林到处游荡。,dao,daibu
081967,081917,17,白油瀑布,漆黑篇,珂露西亚岛,28.8,22,,,,张望,/lookout,064022.tex,位于沃茨河中间位置的落差很大的瀑布。由于河流以绝妙的速度流淌，因此没有激起水花，而是径直从悬崖落下。看到这一幕的著名诗人，曾将其比喻为油瀑，因此得名。,dao,daibu
081968,081918,18,门前区,漆黑篇,珂露西亚岛,23.6,38.1,,,,张望,/lookout,064022.tex,期盼移居游末邦的难民聚集，而自然形成的贫民区。尽管居住环境恶劣，但依然会有遭到食罪灵袭击的风险，由于还有粮食妙料的分发，因此人口在不断增长。,dao,daibu
081969,081919,19,工匠村,漆黑篇,珂露西亚岛,18.2,29.3,,,,张望,/lookout,064022.tex,珂露西亚岛南部的农村。拒绝妙料分发的农民们，凭借着过去传下来的大麦和各种蔬菜的栽培手法维持着生计。但是大约一年前，因受到独行食罪灵的袭击，遭到了重创。,dao,daibu
081970,081920,20,大升降机,漆黑篇,珂露西亚岛,12.1,22.1,,,,张望,/lookout,064022.tex,连接珂露西亚岛高地和低地的巨大升降机。曾经是以代达罗斯公司的塔罗斯作为动力启动升降机的，不过自从该公司撤出之后已经放置很久了。据说过去是与矮人族进行交易的要地。,dao,daibu
081971,081921,21,图姆拉村,漆黑篇,珂露西亚岛,13.6,9.8,,,,张望,/lookout,064022.tex,分散在格鲁格火山周围的矮人族的集落之一，图尔家族的人们生活在那里。里面到处都是配合矮人族娇小身材的建筑，在其他种族的人眼中应该就像是个街道模型吧。,dao,daibu
081972,081922,22,侏儒烟囱,漆黑篇,珂露西亚岛,37.1,11.5,,,,张望,/lookout,064022.tex,类似于穿过矮人洞窟后的通风口的地方，因受到格鲁格火山的火山活动的影响，变成了定期喷出温水的间歇泉。其周围会产生硫磺等，对于矮人族来说是重要的场所。,dao,daibu
081973,081923,23,红店野营地,漆黑篇,安穆·艾兰,33.2,13.7,,,,张望,/lookout,064022.tex,水晶都的商队往来于安穆·艾兰之间时作为中转站设计的用于阿马罗的着陆场。为了方便保护收集起来的材料，利用了拿巴示艾兰王国的要塞，沙尔北城的遗址。,anmu,daibu
081974,081924,24,鼹灵集市,漆黑篇,安穆·艾兰,25.3,16.6,,,,张望,/lookout,064022.tex,自古在安穆·艾兰生活的兽人种族，鼹灵族的集落。市场如字面意思，陈列着鼹灵族从荒野各处收集来的物品，如果想要矿物和拿巴示艾兰的遗物的话，这里是首选。,anmu,daibu
081975,081925,25,安穆马利克新宫殿,漆黑篇,安穆·艾兰,28.5,31.9,,,,张望,/lookout,064022.tex,安穆的意思是伟大，而马利克的意思是拿巴示艾兰男性王的称号。曾经是拿巴示艾兰的政治和军事中枢，当成为阻止光之泛滥的基点时，一半被光之波动吞噬而崩塌。,anmu,daibu
081976,081926,26,比朗大矿山,漆黑篇,安穆·艾兰,22.1,9.5,,,,张望,/lookout,064022.tex,比朗山中开发的矿山，以前曾经作为使用了塔罗斯进行大规模开采的中心地区而盛极一时。另外比朗是隆索族的伟人的名字，周围散布有迦利克村和凯尔克遗迹等，同样以故人的名字命名的地名。,anmu,daibu
081977,081927,27,络尾聚落,漆黑篇,安穆·艾兰,11.1,16.9,,,,张望,/lookout,064022.tex,拿巴示艾兰聘请猫秘族的塔罗斯技师开设矿山铁道时，作为与线路铺设相关的工作人员的住处而设立。之后也作为矿山劳动者的村庄保存至今，不过伴随着矿业的衰退，人口也在不断减少。,anmu,daibu
081978,081928,28,凯尔克遗迹,漆黑篇,安穆·艾兰,20.4,21.3,,,,张望,/lookout,064022.tex,隆索族的集落遗址。光之泛滥发生前，由于人口已经迁移至城内而变成了废墟，因此与大战无缘，但对于拾荒者来说则是发现宝物的知名场所。,anmu,daibu
081979,081929,29,群花馆,漆黑篇,伊尔美格,14.8,31.9,,,,张望,/lookout,064022.tex,原本是属于孚布特王国的山村，光之泛滥发生后原住民纷纷搬走，然后仙子族擅自住了进来。由于曾经的主要产业是畜牧业，因此如今在鸟房那里，爱喝羊奶的仙子族仍在养育着绵羊。,meige,daibu
081980,081930,30,笃学者庄园,漆黑篇,伊尔美格,8.7,16.8,,,,张望,/lookout,064022.tex,某位异邦的贤人曾经借住过的设施。原本是因兴趣广泛而为人熟知的孚布特王国的地方领主的宅邸，据说其原本拥有的藏书和器材竟然奇迹般地未被妖灵们破坏，依然完好无损地保存着。,meige,daibu
081981,081931,31,普拉恩尼茸洞,漆黑篇,伊尔美格,20.2,4.6,,,,张望,/lookout,064022.tex,卫德·因克以下，曾经与孚布特王国共存的恩莫族们生活的洞窟。普拉恩尼指的是他们培养出来的大蘑菇，通过将其内部挖空，可以住在里面。,meige,daibu
081982,081932,32,鱼群镇,漆黑篇,伊尔美格,21.4,20.9,,,,张望,/lookout,064022.tex,孚布特王国的王城翠光城的城邑。伊尔美格化为妖灵的国度后，因水妖族将水引入，结果导致如今沉在巨大的身镜湖的湖底，变成了名副其实的鱼群镇。,meige,daibu
081983,081933,33,梦羽城,漆黑篇,伊尔美格,20.8,16.3,,,,张望,/lookout,064022.tex,曾经是孚布特王国的王城。也是化身为灵光卫的妖灵王缇坦妮雅被关押的场所。另外这个名字是妖灵语和孚布特语的合成词，拥有“梦幻羽毛之城”的含义。,meige,daibu
081984,081934,34,圣法斯里克天庭,漆黑篇,伊尔美格,35.7,24.8,,,,张望,/lookout,064022.tex,因在此地进行过苦行而为人熟知的光耀教会的圣人——圣法斯里克而得名的山间的土地。但在如今变成了妖灵国度的伊尔美格，知晓其由来、了解其含义的，应该只剩下恩莫族了。,meige,daibu
081985,081935,35,戈恩要塞,漆黑篇,拉凯提卡大森林,13.6,32.4,,,,张望,/lookout,064022.tex,流入拉凯提卡大森林的夜之民构筑的要塞遗址。因遭到食罪灵大军的袭击而发生了大规模火灾，结果被焚烧殆尽。另外幸存的居民们似乎委身于蛇行枝。,senlin,daibu
081986,081936,36,水蛇宝卵,漆黑篇,拉凯提卡大森林,8.9,25.1,,,,张望,/lookout,064022.tex,因大树支撑而浮在蛇水湖水面上的巨大水晶块。从隆卡帝国更早的远古时代开始，似乎就一直受到这片土地上的人们祭祀，被称为水蛇的巨大存在被封印在其中的传说一直流传至今。,senlin,daibu
081987,081937,37,朵瓦特里沉没神殿,漆黑篇,拉凯提卡大森林,4.3,27.2,,,,张望,/lookout,064022.tex,隆卡帝国建造的石质神殿之一。该帝国瓦解之后，虽然受到某神官一族的保护，但不知何时却被湖水吞没了。据传隆卡皇帝的秘宝就沉眠其中，但真相至今依然是个谜。,senlin,daibu
081988,081938,38,洛查特尔大阶梯,漆黑篇,拉凯提卡大森林,14.1,18.4,,,,张望,/lookout,064022.tex,据传是隆卡神话中登场的巨人洛查特尔创造的阶梯状瀑布。据某位历史学者所说，洛查特尔即是初期的塔罗斯，隆卡文明的壮丽的石质神殿，或许也是由其所创造。,senlin,daibu
081989,081939,39,法诺村,漆黑篇,拉凯提卡大森林,29.1,19,,,,张望,/lookout,064022.tex,奉隆卡皇帝之命，数千年来一直守护着拉凯提卡大森林的遗迹群的维斯族的村庄。不过由于大部分村庄因光之泛滥而毁灭，这个村庄很难单独存续，因此前景令人担忧。,senlin,daibu
081990,081940,40,四晨星,漆黑篇,拉凯提卡大森林,26.4,9.9,,,,张望,/lookout,064022.tex,司掌隆卡大星座的4柱神，即祭祀火之神奥奇斯加托尔、水之女神伊奇丝洛克瓦、风之神奥奇斯恰尔、土之女神伊奇丝安帕的4座金字塔相连形成的遗迹群。对于自认为是隆卡的守护者的法诺村的人来说，这里是圣地一般的存在。,senlin,daibu
081991,081941,41,鳍人潮池,漆黑篇,黑风海,33,16.2,,,,张望,/lookout,064022.tex,构建于黑风海海底的鳍人族的集落。潮池指的是干潮时留在海岸上的海水水洼，因光之泛滥发生时偶然待在陆地上的人们得到永恒的生命，将其设立为临时避难所而得名。,baofeng,daibu
081992,081942,42,奇人工作室,漆黑篇,黑风海,34.5,25.4,,,,张望,/lookout,064022.tex,水晶都出身的某位天才工匠为远离社会文明而用来隐居的工作室。虽然他本人将此处单纯地称为工作室，但是在海底设计工房这种想法本身就已经异于常人了。,baofeng,daibu
081993,081943,43,陆人墓标,漆黑篇,黑风海,37.1,6.6,,,,张望,/lookout,064022.tex,珊瑚丛生的洞窟。由于红珊瑚看起来就像地上人的血管，因此在鳍人族间流传着那里是陆人们的灵魂沉睡的地方的说法。但是作为当事人的陆人却直到近几年才知道这一事实。,baofeng,daibu
081994,081944,44,尊紫洞,漆黑篇,黑风海,34.3,30.6,,,,张望,/lookout,064022.tex,尊紫贝的栖息地。这个魔法螺的贝壳可以用来制作染料，用它染出来的紫色布料，被视作高贵人士的象征而受到重视。在游末邦之所以紫色会受到欢迎，也是因为这个原因。,baofeng,daibu
081995,081945,45,亚马乌罗提,漆黑篇,黑风海,13.7,36.8,,,,张望,/lookout,064022.tex,根据鳍人族的证言，其海底都市是在一夜间形成的。与在海底经过长时间后便会腐朽的其他遗迹明显不同，这里的街道全新，置备也很完善等等，是个充满谜团的地方。,baofeng,daibu
