小图代码,大图代码,顺序,名称,版本,地点,X,Y,天气,天气图片,时间,动作,动作代码,动作图片,备注,位置图片1,位置图片2
081868.tex,081368.tex,60,水晶增殖炉,苍天篇,魔大陆阿济兹拉,10,14,,,,张望,/lookout,064022.tex,旨在利用三斗神的能力，将合成生物的生命能量结晶化，从而增殖水晶的幻之永久机关。这里曾经进行过用生产出的水晶进而培养合成生物，通过循环来获得无限力量的研究。,mdl,23060
081869.tex,081369.tex,61,生体培养局,苍天篇,魔大陆阿济兹拉,35,6,,,,张望,/lookout,064022.tex,亚拉戈帝国魔科学部旗下的合成生物培养设施。该设施接收魔科学研究所等各地研究机关的各种“独创性的委托”，培养各种各样的实验生物。与作为其附属设施的人工诱变所相邻接。,mdl,23061
081870.tex,081370.tex,62,古代大教堂,苍天篇,魔大陆阿济兹拉,25,28,,,,张望,/lookout,064022.tex,南方大陆“美拉西迪亚”风格的古代大教堂。似乎是南方大陆的树状种族为了祭祀三斗神之一的魔神萨菲洛特而建造的。亚拉戈人为了研究信仰和蛮神之间的关联，而将该教堂迁移了过来。,mdl,23062
081526.tex,081026.tex,1,威罗迪纳基地,红莲篇,基拉巴尼亚边区,21,26,,,,张望,/lookout,064022.tex,加雷马帝国设在威罗迪纳大桥上的物资中转基地，位于威罗迪纳河之上。连接着军事设施众多的山区与封锁了艾欧泽亚的巴埃萨长城。中央那座巨大的塔是飞空艇的系留塔。,bq,24001
081527.tex,081027.tex,2,幻我园,红莲篇,基拉巴尼亚边区,24,16,,,,张望,/lookout,064022.tex,约300年前由拉尔戈星导教高僧海伊马特开拓的僧园。“幻我”这个词由古代玛哈语而来，意思是“自己的幻景”，这就表示了这里是直面自己的幻影从而磨炼身心的地方。,bq,24002
081528.tex,081028.tex,3,开宗堂,红莲篇,基拉巴尼亚边区,23,7,,,,张望,/lookout,064022.tex,很久很久以前，一个想要接近破坏神拉尔戈的男子开始了用拳头击打岩石山的修行，几十年后，他终于将岩山石击出了一个大洞。这位无名修炼者就是星导教的第一位武僧，而这里也被后人当成了教义的开创之地，并建造了这个祠堂。,bq,24003
081529.tex,081029.tex,4,帝国东方堡,红莲篇,基拉巴尼亚边区,9,10,,,,张望,/lookout,064022.tex,加雷马帝国建立的据点。原本是巴埃萨长城的建设据点，在第七灵灾后盖乌斯再次侵略艾欧泽亚的时候，被提升为了扩建后的帝国堡。现在位于双蛇党的管辖之下。,bq,24004
081530.tex,081030.tex,5,昏暗林,红莲篇,基拉巴尼亚边区,8,26,,,,张望,/lookout,064022.tex,位于东境混交林南部的大片阴暗的森林。在提蒙河流淌而来的河水与各处涌出的地下水的影响下，森林中常年弥漫着湿漉漉的雾气。因此，无论白天还是夜晚都十分昏暗。,bq,24005
081531.tex,081031.tex,6,天母寝宫,红莲篇,基拉巴尼亚边区,36,16,,,,张望,/lookout,064022.tex,阿难陀族建筑的泥城。据说地下有供奉美神吉祥天女的地下神殿，因此人们才会将这里命名为阿难陀语的“天母寝宫”。现在则被主流派的伽黎亚派占据着。,bq,24006
081532.tex,081032.tex,7,对等石,红莲篇,基拉巴尼亚边区,30,25,,,,张望,/lookout,064022.tex,梅氏的逐日之民们居住的村落。为了能够将猎物和入侵者尽收眼底，他们将村落建在了可以展望整个地盘的岩石山之上。在帝国的支配下，猎户们逐渐被视为野蛮者，处境十分艰辛。,bq,24007
081533.tex,081033.tex,8,藏泪丘,红莲篇,基拉巴尼亚山区,33,10,,,,张望,/lookout,064022.tex,悼念死者的地方。背后有飞流直下的瀑布，隆隆的声音响彻云霄，可以掩盖哭声；飞溅的水珠迎面扑来，可以隐藏泪水。但是在帝国长年的支配下，宗教活动全部被禁止，人们甚至无法自由地祭奠死者。,sq,24008
081534.tex,081034.tex,9,寒炉村,红莲篇,基拉巴尼亚山区,27,36,,,,张望,/lookout,064022.tex,伫立在基拉巴尼亚山区深山之处的贫寒村落。因为土地贫瘠收成不好，自古以来靠年轻人外出当佣兵赚钱勉强维持生计。也是阿拉米格的猛牛——劳班·阿尔丁出生的故乡。,sq,24009
081535.tex,081035.tex,10,纽恩克雷夫的方舟,红莲篇,基拉巴尼亚山区,22,32,,,,张望,/lookout,064022.tex,在大洪水袭击艾欧泽亚的第六灵灾发生时，北洋出身的纽恩克雷夫为了拯救人们建造了这只方舟。它救起了一个个遭遇海啸漂浮在海上的人们后，整条船都被魔法传送走了，最终漂到了这个地方。,sq,24010
081536.tex,081036.tex,11,阿拉加纳,红莲篇,基拉巴尼亚山区,25,5,,,,张望,/lookout,064022.tex,位于基拉巴尼亚山区北部的村落。过去因采矿业而繁荣一时，连装饰阿拉米格王宫的美丽石材都是由这个村落的凿石匠凿下来的。然而，现在却面对着产业衰退的危机。,sq,24011
081537.tex,081037.tex,12,御制监望塔,红莲篇,基拉巴尼亚山区,19,23,,,,张望,/lookout,064022.tex,加雷马帝国军的巨大监视塔。主塔是为了监视其行省基拉巴尼亚而最先建造的，之后又加入了为了再次侵略艾欧泽亚而增建的通讯塔以及为了启动究极神兵而增建的能量塔。,sq,24012
081538.tex,081038.tex,13,赎罪之腕,红莲篇,基拉巴尼亚山区,8,37,,,,张望,/lookout,064022.tex,只要修身养性，就可以赎清罪孽。在拉尔戈星导教的这则教义下，人们建造了这个地方来让犯罪者赎罪。据说只要在这间寺院进行七年的严酷修行，无论犯过多么深重的罪都会得到破坏神的宽恕。,sq,24013
081539.tex,081039.tex,14,赤红神塔,红莲篇,基拉巴尼亚山区,18,14,,,,张望,/lookout,064022.tex,在第六灵灾末期至第六星历初期建造的遗迹。据说是由来自无限城与玛哈，这两个过去曾经过立的魔法城邦的魔法师们为了平息灵灾造成的混乱气候而建造的，类似于地脉镇石的建筑。,sq,24014
081540.tex,081040.tex,15,启程回廊,红莲篇,基拉巴尼亚山区,7,7,,,,张望,/lookout,064022.tex,据说很久以前，在拉尔戈星导教的总部结束了修行的武僧在这条回廊进行了启程的仪式。当时包括星导山寺院的参拜者在内，有很多人造访这里，曾经热闹一时。但在废王泰奥德里克的命令下，现在早已被烧成了一片废墟。,sq,24015
081541.tex,081041.tex,16,要塞城邦阿拉米格,红莲篇,基拉巴尼亚湖区,23,33,,,,张望,/lookout,064022.tex,第六星历1135年，统一了基拉巴尼亚地区的霸王安兹海尔姆为了迎击从伊尔萨巴德大陆流入的势力而建造的要塞城邦。在加雷马帝国的统治之下，行省总督府被设置在了这里，这也是帝国支配的象征。,hq,24016
081542.tex,081042.tex,17,阿拉米格人居住区,红莲篇,基拉巴尼亚湖区,35,33,,,,张望,/lookout,064022.tex,要塞城邦阿拉米格南部的居住区。为了配合人口的增长而最新扩建的区域，因此距离王宫十分遥远，从建立起就被当成了苦力街。在帝国的统治下，似乎已经变成了没有市民权的人居住的地方。,hq,24017
081543.tex,081043.tex,18,望云塔,红莲篇,基拉巴尼亚湖区,13,35,,,,张望,/lookout,064022.tex,为了监视云海而设置在城邦与北州伊尔萨巴德大陆之间的塔。一旦发现入侵者，就会从塔的顶层放出带火的箭，通知城邦有危险。但是，在帝国的支配下却从来没有使用过。,hq,24018
081544.tex,081044.tex,19,圣礼拜台,红莲篇,基拉巴尼亚湖区,20,16,,,,祈祷,/pray,064064.tex,为了参拜矗立在盐湖的破坏神拉尔戈像而设的礼拜台。只要登上最顶层，就可以在破坏神面前献上祈祷。在废王泰奥德里克的统治下，也是一个被当作刑场使用的恶名昭彰的地方。,hq,24019
081545.tex,081045.tex,20,地下水路,红莲篇,基拉巴尼亚湖区,33,30,,,,张望,/lookout,064022.tex,为了将盐湖的水引入阿拉米格城市内而开辟的水路。人们将在这里取到的盐水蒸馏成淡水后加以饮用。因为帝国安设了魔导式水道的缘故，现在几乎没有人再来这里了。,hq,24020
081546.tex,081046.tex,21,天营门,红莲篇,基拉巴尼亚湖区,5,22,,,,张望,/lookout,064022.tex,是帝国白山堡的正门（天营门），正确地说是正门的一部分。在帝国侵略之前，这里是通往阿拉米格的主干道的关口，前往近东地区的商队络绎不绝。,hq,24021
081576.tex,081076.tex,22,赤诚组营房前,红莲篇,黄金港,14,9,,,,张望,/lookout,064022.tex,维护黄金港治安的组织——赤诚组的营房前。在正对广场的茶屋里能看到不当班的赤诚组成员。另外，抬头望去还能看到宏伟的黄金阁天守，因此这里也是一个著名的景点。,hjc,24022
081577.tex,081077.tex,23,望海楼,红莲篇,黄金港,9,7,,,,坐下,/sit,064054.tex,以眺望大海的温泉——“望海泉”为招牌的黄金港温泉旅馆。远东之国的公共浴池大多是男女混浴，任何人都可以裸身进入。可是在有着众多异国人的黄金港泡温泉时，则需要穿上类似泳衣的衣服。,hjc,24023
081578.tex,081078.tex,24,小金街,红莲篇,黄金港,13,12,,,,张望,/lookout,064022.tex,在遍地生财的商业港口“黄金港”中象征着赚取零钱的商店街。这里聚集着各种各样的店铺，从出售由异国商船运来的进口货的店铺到将远东之国的特产出售给异国商人的店铺应有尽有。另外，剧场“无地鼓座”也是这里的名产之一。,hjc,24024
081579.tex,081079.tex,25,小金街后巷,红莲篇,黄金港,11,11,,,,张望,/lookout,064022.tex,小金街的后巷。这里可以看到东方特有的拱型太鼓桥——黄昏桥，还可以将国立的造船厂——黄金船库与建在其上的飞空艇搭乘点等堪称黄金港名胜的地点一览无余。,hjc,24025
081580.tex,081080.tex,26,潮风亭,红莲篇,黄金港,10,10,,,,张望,/lookout,064022.tex,黄金港最大的酒馆。这里不仅有当地的商人和港湾的劳动者，还有很多异国人。据说这里的特产是从远东之国的紫州运来的米酒与使用新鲜的海产烹饪的各种东方菜肴。,hjc,24026
081581.tex,081081.tex,27,碧玉水,红莲篇,红玉海,25,13,,,,张望,/lookout,064022.tex,由碧甲甲人族建立的海底村落。甲人族虽然可以长时间屏气，但毕竟不能像鱼人族那样用鳃呼吸。因此，他们在漫长的历史中研究出了一种魔法性技术，可以将巨大的气泡固定在水中。,hyh,24027
081582.tex,081082.tex,28,冲之岩,红莲篇,红玉海,32,8,,,,张望,/lookout,064022.tex,漂浮在红玉海上的小岛之一。北侧有着巨大的珊瑚群，还有占领了红玉海的海贼众建立的据点。另外，据远东之国的博物学者所说，这个岛是由狱之盖的喷石而形成的。,hyh,24028
081583.tex,081083.tex,29,天之御柱,红莲篇,红玉海,24,5,,,,张望,/lookout,064022.tex,通天的巨大石塔。在流传于东方地域的神话中，这里是由孕育国土的神明建造的，但真相却不得而知。历史上虽然曾经是禁忌之地，但在战乱期却被不惧神明的海贼众登陆，他们还在这里建立了据点痉挛寨。,hyh,24029
081584.tex,081084.tex,30,酒杯岛,红莲篇,红玉海,31,37,,,,张望,/lookout,064022.tex,据说这个岛是海贼众最初举杯结为兄弟的地方。对海贼众来说，这是个堪称发祥地的特别之地。即便是现在，他们还会在岛上设置监视据点，监视来往于红玉海的船只。,hyh,24030
081585.tex,081085.tex,31,绝鬼岛,红莲篇,红玉海,10,26,,,,张望,/lookout,064022.tex,红甲族的据点。因为这里是居住着杀人恶鬼的岛，所以红甲族将其命名为“绝鬼岛”，但不知从何时起，连甲人族都开始这样称呼这个岛了。另外，这里过去虽然是座岛，但却通过熔岩与大陆本土连接在一起，所以严格说来并不算岛屿。,hyh,24031
081586.tex,081086.tex,32,渔村,红莲篇,红玉海,6,10,,,,张望,/lookout,064022.tex,位于奥萨德次大陆东岸的村落，村名意味着这个村子是靠渔业建立起来的。海贼众过去曾在这里设置了一个小屋，用来向渡过红玉海的人们征收保护费。,hyh,24032
081587.tex,081087.tex,33,岩燕庙,红莲篇,延夏,12,26,,,,张望,/lookout,064022.tex,用来供奉岩燕这位伟大武将的灵庙，是他让战火纷飞的延夏实现了统一。岸壁上的巨大石像是以岩燕为原型雕刻的。另外，他不仅是一名剑豪，还是一位著名的术士，据说创立多玛式风水术的始祖就是他。,yx,24033
081588.tex,081088.tex,34,帝国河畔堡,红莲篇,延夏,30,32,,,,张望,/lookout,064022.tex,25年前帝国军用来当攻占多玛的前哨基地而设立的据点。在控制了多玛之后也曾把这里当成占领统治的据点短时间利用过，但近年来，由于多玛城的重建工程持续推进，中流部分已经被遗弃，这里几乎没人再使用了。,yx,24034
081589.tex,081089.tex,35,茨菰村,红莲篇,延夏,34,18,,,,张望,/lookout,064022.tex,位于延夏的玄水连山的山村。古语“茨菰”的意思是生长在水田等地的一种草，表示这个村子从很久以前就是个种稻的米仓。村民们一直在帝国的残酷统治下保护着这片水田。,yx,24035
081590.tex,081090.tex,36,七彩沟,红莲篇,延夏,30,6,,,,张望,/lookout,064022.tex,流淌着七色水的神奇泉眼。人们认为是因为这里充满了露出地面的优质水晶矿床，在属性之力的作用下才形成了这么美丽的景色。不过，也有传说说这是由天女架起的彩虹之桥而来的。,yx,24036
081591.tex,081091.tex,37,多玛王城,红莲篇,延夏,14,6,,,,张望,/lookout,064022.tex,支配延夏的多玛国的城池。是为了管理既是物流大动脉又是周边地区水源的无二江，而利用突出江面的石山而搭建的。在帝国的支配下，这里被当成了行省的总督府，同时还扩展了军事功能。,yx,24037
081592.tex,081092.tex,38,大龙月门,红莲篇,延夏,19,20,,,,张望,/lookout,064022.tex,为了管理前往无二江的江船而建造的巨大水门。利用了天然的岩石山建造的大龙壁中央，镶嵌着一道满月型的门。帝国军为了加强对河川的支配，在这里增设了魔导结界发生器。,yx,24038
081593.tex,081093.tex,39,弓束官邸,红莲篇,延夏,15,31,,,,张望,/lookout,064022.tex,管理着无二江中流城市的地方官的宅邸。地方官由代代侍奉多玛国主一族的名门弓束家当家担任。多玛叛乱的时候这里被烧成了废墟，现在则成了鲶鱼精们的栖息地。,yx,24039
081594.tex,081094.tex,40,乔尔艾恩石环,红莲篇,太阳神草原,14,9,,,,张望,/lookout,064022.tex,位于巴儿达木霸道附近的石柱群。石柱上刻着游牧民们的古老歌谣。另外，石柱看上去像是随便分布的，但据说每当有风从这里吹过，就会听到类似于古老旋律的声音。,cy,24040
081595.tex,081095.tex,41,朵塔儿水洲,红莲篇,太阳神草原,12,32,,,,张望,/lookout,064022.tex,游牧的暮晖之民朵塔儿部生活的地方。“水洲”意味着这里是一个涌水之处，也是干燥的月神沙漠中极为珍贵的绿洲。在南部的沙漠地带旅行的时候，需要在这里进行最后的补水。,cy,24041
081596.tex,081096.tex,42,暮晖王座,红莲篇,太阳神草原,19,33,,,,张望,/lookout,064022.tex,象征着第一位敖龙族女性“暮晖之母”的巨大石像。意味着这里是月神创造暮晖之母的地方。可是带着沙尘的风不断吹向这里，使得石像渐渐风化，现在已经快要被埋入沙地之中了。,cy,24042
081597.tex,081097.tex,43,重逢集市,红莲篇,太阳神草原,34,31,,,,张望,/lookout,064022.tex,暮晖之民中的凯苏提尔部建立的交易所。“重逢”这个名字象征着分裂成了50多个部族的暮晖之民希望能够在这唯一的地方重新变回一个部族的心愿。现在已经有很多居住在草原的部族加入其中，还有异国的商人也会造访。,cy,24043
081598.tex,081098.tex,44,恰佳遗骨堂,红莲篇,太阳神草原,20,12,,,,祈祷,/pray,064064.tex,安置暮晖之民圣人恰佳的遗骨的地方，据说他曾经英勇对抗巨大的龙，从而保护了人们与家畜。在那达慕大战中胜利的部族会在战后来到这里献上供品，这个传统仪式一直流传至今。,cy,24044
081599.tex,081099.tex,45,晨曦王座,红莲篇,太阳神草原,22,21,,,,张望,/lookout,064022.tex,传说中太阳神创造第一位敖龙族男性“晨曦之父”的圣地。经过了历代的强大部族的统治与重建，现在太阳湖上已经建起了巨大的台座，还有一座耸入云霄的巨大宫殿。,cy,24045
081547.tex,081047.tex,46,破坏神像,红莲篇,神拳痕,10,9,,,,张望,/lookout,064022.tex,破坏与彗星之神拉尔戈的神像。是由星导教的僧侣与信徒们花费了数百年的时光，一点一点地雕凿山岩建造而成的。因其过于巨大，相传就连火烧星导寺的泰奥德里克王也拿它没办法。,sqh,24046
081548.tex,081048.tex,47,血雨的训诫,红莲篇,神拳痕,11,13,,,,张望,/lookout,064022.tex,破坏神像脚下的石碑。上面刻有星导教高僧所留下的话：“七狱门开七天堕泪血雨狂潮动荡破坏神拳所及之处众生皆留痕伤”。,sqh,24047
081549.tex,081049.tex,48,呵欠洞,红莲篇,基拉巴尼亚边区,27,35,,,18:00～04:59,张望,/lookout,064022.tex,欧米茄和神龙的大战所留下的痕迹。神龙如同呵欠一般张大嘴，放出的光芒在地面上留下了这个大洞，因此称为呵欠洞。如果那道光的轨道再稍微偏一点的话，恐怕梅氏的村子就要不保了吧。,bq,24048
081626.tex,081126.tex,49,阿拉基利,红莲篇,基拉巴尼亚山区,14,36,,,,张望,/lookout,064022.tex,基拉巴尼亚山区的驿站。位于从阿拉米格通往乌尔达哈与格里达尼亚两个地区的交通要道，曾也是与东方进行陆路贸易的重要的中转站。在帝国的统治下，则主要以驻扎在军事据点内的兵将们为买家进行交易。,sq,24049
081627.tex,081127.tex,50,御制监望塔2,红莲篇,基拉巴尼亚山区,20,22,,,,张望,/lookout,064022.tex,加雷马帝国军巨大的监视塔。名称的含义为皇帝的监视塔。位于崇山峻岭所环绕的山区的中央，不断监视着帝国支配下的村落。对于阿拉米格的人民们来说，它就是压迫与暴政的象征。,sq,24050
081628.tex,081128.tex,51,沉没的破坏神像,红莲篇,基拉巴尼亚湖区,17,19,,,,张望,/lookout,064022.tex,作为拉尔戈星导教被指定为阿拉米格国教的纪念而被供奉起来的破坏神石像。在阿拉米格最后的王泰奥德里克与星导教对立之时，它被直属于王的近卫队所破坏，沉入到了盐湖之中。,hq,24051
081629.tex,081129.tex,52,阿拉米格人居住区2,红莲篇,基拉巴尼亚湖区,36,33,,,,张望,/lookout,064022.tex,要塞城邦阿拉米格南部的居住区。在帝国的统治下，这里被指定为没有市民权的“安”阶级的人们的居住区，根据对他们的“游荡民”这一蔑称，这里在当时被称为游荡民居住区。而这一歧视性的称呼，如今也成了过去。,hq,24052
081676.tex,081176.tex,53,瑞光像,红莲篇,黄金港,11,9,,,,张望,/lookout,064022.tex,以武辺之瑞光为原型的铜像。他作为在黄金港所在的岛屿“紫州”南部建立末之国的武将而为人所熟知。只是，黄金港本身为幕府直辖领地，因此不属于末之国。,hjc,24053
081677.tex,081177.tex,54,乐座街,红莲篇,黄金港,9,8,,,,张望,/lookout,064022.tex,根据远东之国幕府的特例，与商业有关的限制被大幅减缓的商业街。从贩卖各种商品的店铺，到提供给国内外的商人与旅客的住宿设施和娱乐设施等等，一应俱全。,hjc,24054
081678.tex,081178.tex,55,转魂塔广场,红莲篇,黄金港,12,10,,,,张望,/lookout,064022.tex,转魂塔，即以太之光所在的广场。在远东之国，这种设施自古以来都是由被称为鬼师众的神秘技术集团进行制造并保护管理的。因为这里是交通枢纽，赤诚组的监视也很严格。,hjc,24055
081679.tex,081179.tex,56,黄金船库,红莲篇,黄金港,9,12,,,,张望,/lookout,064022.tex,由黄金港奉行所设立的造船厂。其目的并非是为了建造关船这类的大型船，而是以停泊在黄金港的船只的修理，与小型船只的建造为主。因此，这里的船工们很多也都精通外国船只的构造。,hjc,24056
081680.tex,081180.tex,57,紫水宫,红莲篇,红玉海,5,36,,,,张望,/lookout,064022.tex,静静的矗立于苍玉海沟中的海底宫殿。由居住于红玉海海底的翠水之民们建起，他们的统领红玉公主则居住于其中。不只是外人，就算是翠水之民没有特别许可的话也是禁止入内的。,hyh,24057
081681.tex,081181.tex,58,奥萨德东岸,红莲篇,红玉海,9,19,,,05:00～07:59,张望,/lookout,064022.tex,面向红玉海的奥萨德次大陆东岸地区。历来渔业繁盛，海岸线上散布着许多渔村。这里风光明媚，因此也留下了许多诗词。,hyh,24058
081682.tex,081182.tex,59,痉挛寨,红莲篇,红玉海,21,11,,,,张望,/lookout,064022.tex,支配红玉海的海贼众们的根据地。由于畏惧被认为从神话时代起就耸立于此处的神秘巨塔“天之御柱”的缘故，这里自古以来就被人当成禁忌之地。但是海贼众们不惧于神，在此建立了据点。,hyh,24059
081683.tex,081183.tex,60,高速魔导驱逐艇L-XXIII,红莲篇,延夏,35,38,,,,张望,/lookout,064022.tex,沉没于无二江水底的高速魔导驱逐艇的残骸，舰籍编号中的“L”代表其所属于第十二军团，而“XXIII”则意味着它是第23号舰艇。它的任务曾是镇压多玛叛乱，似乎是被守护延夏的妖狐所击沉。,yx,24060
081684.tex,081184.tex,61,模儿衣楼,红莲篇,太阳神草原,31,11,,,,张望,/lookout,064022.tex,暮晖之民的部族之一，模儿部的居留地。会随着家畜所食用的草的变化而移动的模尔部，每个季节都会变换新的居留地。为此，他们的帐篷也都设计得十分便于移动。,cy,24061
081685.tex,081185.tex,62,莫艾石像,红莲篇,太阳神草原,21,20,,,,张望,/lookout,064022.tex,以人脸为原型的巨大石像。在世界各地都有同样的石像存在，但它们的建造者，建造时间以及目的均不明。根据角的有无以及耳朵的位置，有人认为这些石像是出自人族之手，但也只是推测。,cy,24062
081951,081901,1,圆顶区,漆黑篇,水晶都,8.6,11.2,,,,张望,/lookout,064022.tex,位于水晶都关口的区域，拥有圆形屋顶的建筑，因有圆形大厅密集排列而得名。黑铁架构搭配结晶材料的建筑设计，相信会给到访者留下深刻印象。,sjd,daibu
081952,081902,2,宇宙和音,漆黑篇,水晶都,10.4,13.1,,,,张望,/lookout,064022.tex,水晶都最大的商业区域。虽然名字的意义“宇宙的调和”稍微有些夸张，但除了中庸工艺馆生产的产品以外，还陈列着交易商们运来的安穆·艾兰及珂露西亚岛的各类商品，产品种类之齐全令人惊叹。,sjd,daibu
081953,081903,3,博物陈列馆,漆黑篇,水晶都,9.9,5.9,,,,张望,/lookout,064022.tex,收集了残存在诺弗兰特的所有书籍的大书库，占据三学科（三艺）的文法区的设施。藏书从包括史书在内的各类学术书籍到绘本等，种类繁多。,sjd,daibu
081954,081904,4,炸裂圆塔群,漆黑篇,水晶都,11,4.7,,,,张望,/lookout,064022.tex,水晶都北部的区域。圆柱形的各类建筑物作为居住区域和生产设施、防卫设施等各司其职。对于因光之泛滥而产生的难民来说，希望可以从这里重获新生，因此得名。,sjd,daibu
081955,081905,5,圣林牧场,漆黑篇,水晶都,7.3,9.7,,,,张望,/lookout,064022.tex,以勇人族为中心进行运营的牧场，家畜也是大同小异，从鸡到陆行鸟均有饲养。另外，蕴含有“神圣森林之巢”的意义的名字，代表着阿马罗居住的传说中的理想乡，实际上饲养着众多的阿马罗。,sjd,daibu
081956,081906,6,光荣门,漆黑篇,游末邦,11.7,8.4,,,,张望,/lookout,064022.tex,通往游末邦的树根层的主门。其厚重门扉的内外完全是两个不同的世界。对于众多贫民来说，通过这个门进入城内意味着一种光荣，但也如字面意思，那只不过是个狭小的门而已。,ymb1,daibu
081957,081907,7,废船街,漆黑篇,游末邦,12.5,14,,,,张望,/lookout,064022.tex,位于游末邦基部的贫民区。因光之泛滥导致无法远洋航海，所以远洋船就失去了用武之地，后来便被当作建材形成了这条街。其中还有将船的一部分直接使用形成的建筑存在。,ymb1,daibu
081958,081908,8,游末邦军司令总部,漆黑篇,游末邦,11.1,11.4,,,,张望,/lookout,064022.tex,以强大著称的游末邦军的司令总部。之前总部是设在了树梢层，但伴随着沃斯里元首上任的政策路线的变更，军队的意义下降，因此被转移到了原本是监狱的这一层。,ymb2,daibu
081959,081909,9,蜂箱夜总会,漆黑篇,游末邦,12.3,10.4,,,,张望,/lookout,064022.tex,为给安稳生活的游末邦的自由市民，献上如蜜蜂蛰刺般的刺激为目的而开设的娱乐设施。在此工作的人不论男女均被称为蜜蜂，所有者则拥有“女蜂王”的称号。,ymb3,daibu
