大图编码,小图编码,版本,飞行,名称,中国区获得方法,国际服获得方法,说明,new
068008.tex,004008.tex,2.1,1,贝希摩斯,购买月卡累积满足9个月,,冒险者行会赠给冒险者的强力坐骑。灵灾之后，一名冒险者在库尔札斯的深山捡到了这只被父母遗弃的贝希摩斯幼崽。付出心血将其养大后，这只巨兽奇迹般地很亲近人类。,0
068007.tex,004007.tex,2.x,1,独角兽,幻术师Lv30支线“我唯一的希望”,,在黑衣森林中偶遇的纯白独角兽。独角兽原产自库尔札斯，在当地也是非常罕见，不知为何会迷路进了森林。因为感激冒险者帮它治伤，成为了冒险者的好伙伴。,0
068006.tex,004006.tex,2.x,1,魔导装甲,"完成主线“超越幻想,究极神兵”",,加雷马帝国军制式配备的骑乘用魔导装甲“死神”型。西德等人用魔法人偶的核心作为控制装置，对这台缴获的装甲进行了各种改造，现在可以说是加隆德炼铁厂式样了。,0
068005.tex,004005.tex,2.x,1,长须豹,积分商城兑换,,年轻而敏捷的长须豹。野生的长须豹是非常凶猛的魔兽，但在其原产地的近东地区也发展出了独特的驯养法。这只长须豹好像是在萨维奈岛接受过作为坐骑的训练。,0
068004.tex,004004.tex,2.x,1,冥鬼之眼,积分商城兑换,,长有翅膀的独眼魔物。根据妖异学者们的分类，是属于妖异十二阶中第5位的中阶妖异。用动物的眼球作媒介可以将其从异界召唤出来，通过强力的魔法加以束缚后可以进行使唤。,0
068003.tex,004003.tex,2.x,1,古菩猩猩,购买数字典藏包获得,,异国的诗人为了表示谢意，赠予了冒险者一把魔法的角笛，可以召唤出这只古菩猩猩。虽然这种动物并不温顺，但独自徘徊在艾欧泽亚的这只古菩猩猩却因为喜爱诗人的歌声，而跟随着他一起旅行。,0
068002.tex,004002.tex,2.x,1,遗产陆行鸟,道具商城购买,,因为贤者路易索瓦的秘术，被送往次元缝隙的冒险者们穿越了5年的时光终于能和这只陆行鸟再会。经历了长期无主的流浪生活，这只陆行鸟已经成长得非常勇悍，风貌上别具一格。,0
068001.tex,004001.tex,2.x,1,专属陆行鸟,"角色20级并完成20级主线加入军团后,使用200军票在军团补给员兑换“对应大国防联军名字+陆行鸟券”<br/>即可领取支线任务:“我的专属陆行鸟”<br/>完成任务后获得鸟哨并习得骑乘",,伊修加德产军用陆行鸟。除常见的旅行种以外，还有能够承载鲁加族的大型狩猎种以及专门为拉拉菲尔族改良的贝拉哈迪亚小型种等种类。,0
